{
  "$schema": "https://json-schema.org/draft/2020-12/schema",
  "$id": "https://example.com/schemas/payment-disbursement.json",
  "title": "Payment Disbursement Request",
  "description": "A schema for a simple payment disbursement request.",
  "type": "object",
  "properties": {
    "disbursementId": {
      "description": "A unique identifier for the disbursement request.",
      "type": "string",
      "format": "uuid"
    },
    "recipient": {
      "title": "PaymentRecipient",
      "description": "Details of the person or entity receiving the payment.",
      "type": "object",
      "properties": {
        "name": {
          "description": "The full name of the recipient.",
          "type": "string",
          "minLength": 2
        },
        "email": {
          "description": "The email address of the recipient for notifications.",
          "type": "string",
          "format": "email"
        },
        "bankDetails": {
          "title": "BankAccountDetails",
          "description": "Recipient's bank account information.",
          "type": "object",
          "properties": {
            "accountNumber": {
              "description": "The bank account number.",
              "type": "string",
              "pattern": "^[0-9]{8,12}$"
            },
            "sortCode": {
              "description": "The bank's sort code or routing number.",
              "type": "string",
              "pattern": "^[0-9]{2}-[0-9]{2}-[0-9]{2}$"
            },
            "iban": {
              "description": "International Bank Account Number (IBAN).",
              "type": "string",
              "pattern": "^[A-Z]{2}[0-9]{2}[A-Z0-9]{4}[0-9]{7}([A-Z0-9]?){0,16}$"
            }
          },
          "required": [
            "accountNumber"
          ]
        }
      },
      "required": [
        "name",
        "bankDetails"
      ]
    },
    "amount": {
      "title": "PaymentAmount",
      "description": "The amount and currency of the disbursement.",
      "type": "object",
      "properties": {
        "value": {
          "description": "The numeric value of the amount.",
          "type": "number",
          "exclusiveMinimum": 0
        },
        "currency": {
          "description": "The 3-letter ISO currency code.",
          "type": "string",
          "pattern": "^[A-Z]{3}$"
        }
      },
      "required": [
        "value",
        "currency"
      ]
    },
    "paymentMethod": {
      "description": "The method to be used for the disbursement.",
      "type": "string",
      "enum": [
        "bank_transfer",
        "paypal",
        "stripe"
      ]
    },
    "requestedAt": {
      "description": "The date and time the disbursement was requested.",
      "type": "string",
      "format": "date-time"
    },
    "metadata": {
      "title": "PaymentMetadata",
      "description": "An object for any additional, non-essential data.",
      "type": "object",
      "additionalProperties": true
    }
  },
  "required": [
    "disbursementId",
    "recipient",
    "amount",
    "paymentMethod",
    "requestedAt"
  ]
}
